{
  "schemaVersion": "partitura.v2",
  "projectId": "fixture_sign",
  "sourceChecksum": "sha256:117b959bbef22c8409c0356651999e0d3163066ad3b815de1ac3d6c82901f54c",
  "requiredCoreVersion": "1.0.0",
  "defaultScene": "normal",
  "outputs": [
    { "id": "output_1", "name": "Output 1", "output": 1, "pixelCount": 3 },
    { "id": "output_2", "name": "Output 2", "output": 2, "pixelCount": 0 },
    { "id": "output_3", "name": "Output 3", "output": 3, "pixelCount": 0 }
  ],
  "pixelMap": [
    { "index": 0, "id": "px_1_0", "output": 1, "serialIndex": 0, "stringId": "route_a", "routeOffsetCm": 0, "x": 0, "y": 0, "tangentDeg": 0, "normalizedX": 0, "normalizedY": 0 },
    { "index": 1, "id": "px_1_1", "output": 1, "serialIndex": 1, "stringId": "route_a", "routeOffsetCm": 1.67, "x": 1.67, "y": 0, "tangentDeg": 0, "normalizedX": 0.5, "normalizedY": 0 },
    { "index": 2, "id": "px_1_2", "output": 1, "serialIndex": 2, "stringId": "route_a", "routeOffsetCm": 3.34, "x": 3.34, "y": 0, "tangentDeg": 0, "normalizedX": 1, "normalizedY": 0 }
  ],
  "zones": [{ "id": "face", "name": "Face", "pixelIndices": [0, 1, 2] }],
  "groups": [{ "id": "full_sign", "name": "Full sign", "pixelIndices": [0, 1, 2] }],
  "scenes": [{ "id": "normal", "name": "Normal", "loop": true, "durationMs": 1000, "tracks": [{ "id": "track_face", "name": "Face", "target": { "type": "group", "id": "full_sign" }, "clips": [{ "id": "clip_solid", "effect": "solid", "coordinateSpace": "global", "startMs": 0, "durationMs": 1000, "layer": 0, "blend": "replace", "params": { "color": "#00AAFF" } }] }] }]
}
